language,id,text,file,node,lineNumber,lock,comment
en,line:041c591,Manaia: Latest host?,C:\Users\lrmcl\OneDrive\Documents\GitHub\G1\Experimentations\Assets\TTBU\Scripts\Yarnspinner\TTBU.yarn,Scene8,710,cc356da8,
en,line:0c3b74a,"Disgruntled Woman: Now, you're really asking too much of me.",C:\Users\lrmcl\OneDrive\Documents\GitHub\G1\Experimentations\Assets\TTBU\Scripts\Yarnspinner\TTBU.yarn,Scene8,712,9b4d6d0c,
en,line:00e1c00,Disgruntled Woman: I'm not a tutor.,C:\Users\lrmcl\OneDrive\Documents\GitHub\G1\Experimentations\Assets\TTBU\Scripts\Yarnspinner\TTBU.yarn,Scene8,713,f226286f,
en,line:040b69f,The woman sighs.,C:\Users\lrmcl\OneDrive\Documents\GitHub\G1\Experimentations\Assets\TTBU\Scripts\Yarnspinner\TTBU.yarn,Scene8,718,51207565,
en,line:03854a9,"Disgruntled Woman: Very well as much as anyone else, but more than you I presume.",C:\Users\lrmcl\OneDrive\Documents\GitHub\G1\Experimentations\Assets\TTBU\Scripts\Yarnspinner\TTBU.yarn,Scene8,719,763d4ac8,
en,line:010d76a,Disgruntled Woman:  I'll tell you what.,C:\Users\lrmcl\OneDrive\Documents\GitHub\G1\Experimentations\Assets\TTBU\Scripts\Yarnspinner\TTBU.yarn,Scene8,720,a20dc459,
en,line:0ca5a67,"Disgruntled Woman: If you can sweet talk a drink for me from the bar, I'll say anything you very well please.",C:\Users\lrmcl\OneDrive\Documents\GitHub\G1\Experimentations\Assets\TTBU\Scripts\Yarnspinner\TTBU.yarn,Scene8,721,191458f9,
en,line:0963a50,"Disgruntled Woman: If I'm to be harassed like a presidential candidate with a mistress, I'd at least want something to swig while you're at it.",C:\Users\lrmcl\OneDrive\Documents\GitHub\G1\Experimentations\Assets\TTBU\Scripts\Yarnspinner\TTBU.yarn,Scene8,722,83b6a27c,
en,line:04fc3a5,"The woman's husband begins to fidget, but seems to have given up on urging otherwise.",C:\Users\lrmcl\OneDrive\Documents\GitHub\G1\Experimentations\Assets\TTBU\Scripts\Yarnspinner\TTBU.yarn,Scene8,723,0966dee8,
en,line:0856a36,Manaia: Any drink preferences?,C:\Users\lrmcl\OneDrive\Documents\GitHub\G1\Experimentations\Assets\TTBU\Scripts\Yarnspinner\TTBU.yarn,Scene8,725,5aea6a0b,
en,line:06f65cd,Manaia: Thank you. I'll find you something.,C:\Users\lrmcl\OneDrive\Documents\GitHub\G1\Experimentations\Assets\TTBU\Scripts\Yarnspinner\TTBU.yarn,Scene8,726,af063b4a,
en,line:066c233,"Disgruntled Woman: Surprise me! Whatever you do, just make it strong.",C:\Users\lrmcl\OneDrive\Documents\GitHub\G1\Experimentations\Assets\TTBU\Scripts\Yarnspinner\TTBU.yarn,Scene8,730,03b1e4ba,
en,line:00a65fc,"Disgruntled Woman: If if doesn't bite back, I will.",C:\Users\lrmcl\OneDrive\Documents\GitHub\G1\Experimentations\Assets\TTBU\Scripts\Yarnspinner\TTBU.yarn,Scene8,731,ab986ac6,
en,line:02d7b19,"The woman laughs, but something tells you she's not entirely joking.",C:\Users\lrmcl\OneDrive\Documents\GitHub\G1\Experimentations\Assets\TTBU\Scripts\Yarnspinner\TTBU.yarn,Scene8,732,08aada19,
en,line:03593c6,Manaia: I've never seen a machine like that.,C:\Users\lrmcl\OneDrive\Documents\GitHub\G1\Experimentations\Assets\TTBU\Scripts\Yarnspinner\TTBU.yarn,Scene9,739,896a67a6,
en,line:0ce5fc0,Bartender: The distiller?,C:\Users\lrmcl\OneDrive\Documents\GitHub\G1\Experimentations\Assets\TTBU\Scripts\Yarnspinner\TTBU.yarn,Scene9,740,2ba9fc1c,
en,line:0b55eda,Bartender:	You'll be hard-pressed to find another machine like it.,C:\Users\lrmcl\OneDrive\Documents\GitHub\G1\Experimentations\Assets\TTBU\Scripts\Yarnspinner\TTBU.yarn,Scene9,741,e669b1d5,
en,line:0b52d2f,Bartender:	It's custom-made.,C:\Users\lrmcl\OneDrive\Documents\GitHub\G1\Experimentations\Assets\TTBU\Scripts\Yarnspinner\TTBU.yarn,Scene9,742,bd160c6d,
en,line:0143e87,Bartender:	Runs on the highest quality Evergreen fuel and expertly processes plants from Sir Faust's private collection.,C:\Users\lrmcl\OneDrive\Documents\GitHub\G1\Experimentations\Assets\TTBU\Scripts\Yarnspinner\TTBU.yarn,Scene9,743,aa14d87d,
en,line:03e27c1,Bartender: The beverages on offer are one of a kind.,C:\Users\lrmcl\OneDrive\Documents\GitHub\G1\Experimentations\Assets\TTBU\Scripts\Yarnspinner\TTBU.yarn,Scene9,744,ab7f2945,
en,line:09ca98f,Bartender:	Carefully designed from the sowing of the ingredients themselves!,C:\Users\lrmcl\OneDrive\Documents\GitHub\G1\Experimentations\Assets\TTBU\Scripts\Yarnspinner\TTBU.yarn,Scene9,745,5f0cbc8d,
en,line:0afc9d7,Bartender:	Might I interest you in one?,C:\Users\lrmcl\OneDrive\Documents\GitHub\G1\Experimentations\Assets\TTBU\Scripts\Yarnspinner\TTBU.yarn,Scene9,746,418dd554,
en,line:0b85861,Bartender:	Our beverages are one of a kind!,C:\Users\lrmcl\OneDrive\Documents\GitHub\G1\Experimentations\Assets\TTBU\Scripts\Yarnspinner\TTBU.yarn,Scene9,749,a98e1f59,
en,line:04c10df,Bartender:	Carefully designed from the sowing of the ingredients themselves!,C:\Users\lrmcl\OneDrive\Documents\GitHub\G1\Experimentations\Assets\TTBU\Scripts\Yarnspinner\TTBU.yarn,Scene9,750,5f0cbc8d,
en,line:0900b63,Bartender:	Might I interest you in one?,C:\Users\lrmcl\OneDrive\Documents\GitHub\G1\Experimentations\Assets\TTBU\Scripts\Yarnspinner\TTBU.yarn,Scene9,751,418dd554,
